id,title,essay
1033,The Impact of Thriller on Pop Culture,"Michael Jackson's ""Thriller,"" released in 1982, revolutionized pop culture with its groundbreaking blend of music, fashion, and visual storytelling. The album not only shattered sales records, becoming the best-selling album of all time, but also redefined music videos as an art form. The iconic 14-minute ""Thriller"" video, with its innovative choreography and cinematic quality, set a new standard for the industry, influencing countless artists and filmmakers. Its impact extended beyond music, permeating fashion with Jackson's signature style, and inspiring a generation of artists to push creative boundaries. ""Thriller"" remains a cultural touchstone, symbolizing the power of music"
1034,Michael Jackson’s Pioneering Music Videos,"Michael Jackson's pioneering music videos transformed the landscape of the music industry, elevating the medium into a form of high art and storytelling. His 1983 release, ""Thriller,"" directed by John Landis, is a landmark in music video history, blending cinematic elements with groundbreaking choreography and special effects. Jackson's videos, such as ""Billie Jean"" and ""Beat It,"" showcased his talent for combining narrative and spectacle, setting a new standard for visual creativity. These videos not only propelled Jackson to unprecedented fame but also underscored the music video as a powerful tool for cultural expression and artistic innovation in the digital age."
1035,The Moonwalk and Michael Jackson’s Dance Legacy,"Michael Jackson's Moonwalk remains an iconic symbol of his unparalleled dance legacy. Debuting during a televised performance of ""Billie Jean"" in 1983, the Moonwalk captivated audiences worldwide with its illusionary backward glide. This move, while not originally invented by Jackson, was refined and popularized by him, becoming synonymous with his name. Jackson's dance style, characterized by its fluidity, precision, and innovation, set new standards in the entertainment industry. His influence extends beyond his own performances, inspiring countless dancers and artists globally. Michael Jackson's Moonwalk is more than just a dance move; it is a testament to his enduring impact on pop culture."
1036,Philanthropy and Humanitarian Work,"Philanthropy and humanitarian work serve as vital conduits for addressing global challenges and fostering societal growth. Philanthropy, often driven by individuals or organizations with substantial resources, focuses on long-term solutions by funding education, healthcare, and social justice initiatives. Humanitarian work, often immediate and crisis-driven, provides essential relief and support during natural disasters, conflicts, and health emergencies. Together, they complement each other by bridging short-term needs and long-term goals. This synergy not only alleviates suffering but also empowers communities to build resilient futures. Ultimately, both endeavors underscore the profound impact of compassion and responsibility in creating a more equitable and humane world."
1037,Fashion and Style Icon,"A fashion and style icon transcends the ephemeral nature of trends, leaving a lasting impact on the world of aesthetics. Such icons possess an innate ability to blend originality with cultural zeitgeist, creating looks that are both timeless and innovative. Icons like Audrey Hepburn and David Bowie have not only influenced fashion but have also shaped societal norms, challenging conventional ideas of beauty and identity. Their style becomes a narrative, a visual storytelling that inspires generations. Ultimately, fashion and style icons redefine what it means to express oneself, encouraging individuality and creativity in a world often constrained by uniformity."
1038,Michael Jackson’s Influence on Modern Artists,"Michael Jackson, often hailed as the ""King of Pop,"" has left an indelible mark on modern artists across various genres. His innovative music, groundbreaking music videos, and electrifying performances set new standards in the entertainment industry. Artists like Beyoncé, Usher, and Justin Timberlake have frequently cited Jackson as a significant influence, adopting his signature dance moves, such as the iconic moonwalk, and his commitment to perfectionism. Jackson's fusion of diverse musical styles, from pop and rock to soul and R&B, paved the way for genre-blending artists today. His enduring legacy continues to inspire artists to push creative boundaries and engage audiences worldwide."
1039,The Controversies Surrounding Michael Jackson,"Michael Jackson, the ""King of Pop,"" remains an enigmatic figure mired in both admiration and controversy. His unparalleled musical talent and innovative contributions to the entertainment industry are undeniable, yet his personal life sparked intense scrutiny. Allegations of child sexual abuse, which emerged in the 1990s and resurfaced in subsequent decades, cast a long shadow over his legacy, leading to divided public opinion. Further controversy stemmed from his drastic physical transformations and eccentric lifestyle. Despite his 2009 death, debates over his innocence or guilt persist, challenging fans and critics alike to reconcile his artistic genius with his troubled personal narrative."
1040,Michael Jackson’s Legacy in the Entertainment Industry,"Michael Jackson's legacy in the entertainment industry is unparalleled, characterized by his innovative music, groundbreaking performances, and profound cultural impact. Known as the ""King of Pop,"" he revolutionized music videos with iconic productions like ""Thriller,"" and his elaborate concerts set new standards for live performances. Jackson's influence extended beyond music; his fashion, dance, and philanthropy left an indelible mark on global culture. Despite controversies, his artistic contributions continue to inspire artists across genres. Jackson's ability to blend diverse musical styles and his relentless pursuit of perfection have cemented his status as a seminal figure in the history of entertainment."
1041,The Role of Technology in Modern Health Care,"Technology plays a pivotal role in modern health care, revolutionizing the way medical services are delivered and experienced. Innovations such as telemedicine have expanded access to care, allowing patients to consult with healthcare professionals remotely, thereby overcoming geographical barriers. Electronic health records streamline patient information management, improving diagnosis accuracy and treatment efficiency. Advanced diagnostic tools and wearable technology enable real-time monitoring and personalized care, enhancing patient outcomes. Moreover, cutting-edge research tools accelerate the development of new treatments and medications. Despite challenges like ensuring data privacy, technology continues to be a transformative force, optimizing health care delivery and fostering a patient-centered approach."
1042,Global Health Care Systems: A Comparative Analysis,"Global health care systems vary significantly across different countries, reflecting diverse cultural, economic, and political landscapes. Universal health care, exemplified by the United Kingdom's National Health Service, provides comprehensive coverage funded by taxation, ensuring all citizens have access to medical services. In contrast, the United States employs a mixed system with private insurance dominance, often resulting in disparities in care access and affordability. Scandinavian countries like Sweden offer robust socialized medicine, prioritizing equity and preventive care. Meanwhile, developing nations face challenges in infrastructure and resource allocation, leading to inconsistent care quality. Comparative analysis reveals the importance of balancing accessibility, quality, and sustainability in health care systems worldwide."
1043,Mental Health Awareness and Support Systems,"Mental health awareness and support systems are crucial components of modern society, playing a vital role in fostering well-being and resilience. As awareness of mental health issues grows, it is essential to dismantle the stigma that often surrounds them. This can be achieved through education, open conversations, and media representation. Support systems, including therapy, support groups, and helplines, provide essential resources for individuals struggling with mental health challenges. By promoting understanding and creating accessible support networks, society can ensure that individuals receive the help they need, fostering a more compassionate and inclusive environment where mental health is prioritized and valued."
1044,The Impact of COVID-19 on Global Health Care,"The COVID-19 pandemic has profoundly impacted global health care, exposing vulnerabilities and catalyzing change. Health systems worldwide faced unprecedented challenges, including overwhelming patient loads and resource shortages. This crisis highlighted the necessity for robust public health infrastructure and emergency preparedness. Additionally, it accelerated the adoption of telemedicine, reshaping patient-doctor interactions and enhancing accessibility. The pandemic underscored disparities in health care access, prompting renewed focus on equity and social determinants of health. Furthermore, it spurred innovation in vaccine development and distribution, emphasizing global collaboration. As nations recover, the lessons learned will shape resilient, adaptive health care systems for future challenges."
1045,Ethics in Health Care Decision-Making,"Ethics in health care decision-making is a crucial aspect of modern medical practice, guiding professionals in delivering patient-centered care while balancing moral principles. At its core, ethical decision-making involves principles such as autonomy, beneficence, non-maleficence, and justice. Autonomy respects patients' rights to make informed choices about their own health, while beneficence and non-maleficence ensure actions aim to benefit the patient and prevent harm. Justice demands fair and equitable treatment for all patients. Ethical dilemmas often arise in areas like end-of-life care, resource allocation, and informed consent, requiring health care providers to navigate complex scenarios with empathy, transparency,"
1046,Health Care Accessibility and Disparities,"Health care accessibility and disparities remain pressing issues globally, affecting millions of individuals' quality of life. Despite advancements in medical technology and treatment, access to healthcare services is unevenly distributed, often along socioeconomic, racial, and geographic lines. Marginalized communities frequently encounter barriers such as high costs, lack of insurance, and insufficient medical facilities, which exacerbate health inequities. These disparities result in poorer health outcomes and increased mortality rates among disadvantaged groups. Addressing these issues requires comprehensive policy reforms aimed at expanding coverage, reducing costs, and enhancing the availability of culturally competent care. Ensuring equitable access is vital for achieving a healthier, more just society."
1047,Preventative Health Care: Trends and Importance,"Preventative health care emphasizes the importance of proactive measures to maintain wellness and avert diseases, reflecting a significant trend in modern medicine. This approach prioritizes regular screenings, vaccinations, and lifestyle modifications to identify risks early and reduce the incidence of chronic conditions like diabetes, heart disease, and cancer. The growing awareness of preventative care is driven by an aging population, rising healthcare costs, and an increased understanding of the social determinants of health. By focusing on prevention, health systems aim to enhance quality of life, improve health outcomes, and reduce financial burdens on individuals and society, underscoring its vital role in sustainable healthcare."
1048,The Rising Costs of Health Care and Possible Solutions,"The rising costs of health care present a significant challenge globally, burdening individuals, families, and national economies. Key factors driving these costs include technological advancements, an aging population, and the prevalence of chronic diseases. To address this issue, possible solutions include implementing preventive care to reduce the incidence of chronic illnesses, promoting price transparency to empower consumer choice, and adopting value-based care models that focus on patient outcomes rather than services rendered. Additionally, leveraging technology such as telemedicine can enhance efficiency and accessibility, potentially lowering costs. Collaborative efforts among government, healthcare providers, and insurers are crucial to achieve sustainable and affordable healthcare systems."
1049,The Role of Big Data and Analytics in Health Care,"Big Data and analytics have revolutionized healthcare by enhancing decision-making, patient outcomes, and operational efficiency. With the influx of vast amounts of health information from electronic health records, wearable devices, and genomic data, healthcare providers can leverage analytics to identify trends, predict outbreaks, and personalize treatment plans. Predictive analytics enables early intervention, reducing hospital readmissions and improving patient care. Additionally, data-driven insights facilitate resource management and cost reduction, addressing financial challenges in healthcare systems. However, the integration of Big Data necessitates stringent data privacy measures to protect sensitive patient information, ensuring ethical and secure utilization of technological advancements in healthcare."
1050,Health Care Workforce Challenges,"The health care workforce faces significant challenges that threaten its ability to provide quality care. A critical issue is the shortage of skilled professionals, exacerbated by an aging population and increasing demand for services. This shortage leads to overworked staff, burnout, and compromised patient care. Additionally, there is a growing need for diversity within the workforce to address health disparities and culturally competent care. Technological advancements require continuous training, yet many institutions lack resources for adequate professional development. Addressing these challenges requires strategic investments in education, policy reforms, and supportive work environments to ensure a resilient and effective health care system."
