id,title,essay
1001,Software Architecture and Design Patterns,"Software architecture and design patterns are fundamental to creating robust, scalable, and maintainable software systems. Software architecture provides a high-level blueprint, defining the system's structure, components, and interactions. It focuses on critical attributes such as performance, security, and modifiability. Design patterns, on the other hand, offer proven solutions to common design problems, enhancing the architecture's efficiency and flexibility. Patterns like Singleton, Observer, and Factory Method streamline development by providing reusable templates that address specific challenges. Together, architecture and design patterns facilitate a structured approach, enabling developers to build complex applications that are easier to understand, extend, and manage over time."
1002,Agile Methodologies and Scrum Practices,"Agile methodologies and Scrum practices have revolutionized software development by promoting flexibility, collaboration, and customer-centric approaches. Agile, a mindset grounded in the Agile Manifesto, emphasizes iterative progress, cross-functional teams, and adaptive planning. Scrum, a popular Agile framework, structures projects into time-boxed iterations called sprints, encouraging regular feedback and incremental improvements. Key roles in Scrum include the Product Owner, Scrum Master, and Development Team, each contributing to a self-organizing and efficient workflow. By prioritizing transparency, inspection, and adaptation, Agile and Scrum enable teams to respond swiftly to changes, fostering innovation and delivering high-quality products that meet evolving customer needs."
1003,Continuous Integration and Continuous Deployment (CI/CD),"Continuous Integration and Continuous Deployment (CI/CD) are essential practices in modern software development that streamline and automate the process of integrating code changes and deploying applications. CI involves the frequent merging of code into a shared repository, allowing for automatic testing to ensure that new changes do not introduce defects. This reduces integration challenges and enhances code quality. CD extends this practice by automating the release of validated builds to production environments, ensuring rapid and reliable software delivery. Together, CI/CD fosters a culture of collaboration and efficiency, enabling teams to respond swiftly to user feedback and evolving business requirements."
1004,Cloud Computing in Software Development,"Cloud computing has revolutionized software development by providing scalable, flexible, and cost-effective resources. By leveraging cloud platforms, developers can access vast computational power and storage without the need for extensive on-premise infrastructure, significantly reducing overhead costs. Cloud services facilitate continuous integration and delivery, enabling faster deployment and iteration of applications, which enhances agility and innovation. Additionally, the collaborative nature of cloud environments supports distributed teams, allowing seamless cooperation across geographies. Security and compliance, often daunting tasks, are also simplified with robust cloud solutions. Overall, cloud computing has become integral to modern software development, driving efficiency and fostering innovation."
1005,DevOps and Infrastructure as Code (IaC),"DevOps and Infrastructure as Code (IaC) are transformative practices in modern software development and IT operations. DevOps emphasizes collaboration between development and operations teams to accelerate software delivery and improve reliability. IaC complements DevOps by enabling automated, version-controlled management of infrastructure using code, which ensures consistency and reduces manual errors. This synergy allows for rapid deployment, scalability, and efficient resource management, ultimately fostering a culture of agility and continuous improvement. By leveraging DevOps and IaC, organizations can achieve faster innovation cycles, improved collaboration, and enhanced operational efficiency, making them essential components of contemporary IT strategies."
1006,Testing and Quality Assurance in Software Development,"Testing and quality assurance (QA) are integral components of software development, ensuring that products meet specified requirements and function correctly. Testing involves executing software with the intent of identifying errors and verifying that the software behaves as expected. QA encompasses broader processes, including planning, monitoring, and improving development practices. Together, these practices help in detecting defects early, reducing costs, and enhancing user satisfaction. Effective QA and testing strategies incorporate both automated and manual testing methods, facilitating thorough evaluation of functionality, performance, and security. By prioritizing testing and QA, development teams can deliver reliable, high-quality software that meets user needs and market standards."
1007,Software Security and Secure Coding Practices,"Software security is a critical aspect of modern technology, ensuring that systems and applications are protected against unauthorized access and vulnerabilities. Secure coding practices are essential in developing resilient software, incorporating principles such as input validation, error handling, and data encryption. By adhering to these practices, developers can mitigate risks like SQL injection, cross-site scripting, and buffer overflows. Moreover, continuous code reviews and security testing enhance the robustness of applications. As cyber threats evolve, prioritizing software security and employing secure coding techniques are paramount in safeguarding sensitive information and maintaining user trust in digital environments."
1008,Performance Optimization in Software Systems,"Performance optimization in software systems is a critical aspect of software engineering aimed at enhancing the efficiency and responsiveness of applications. It involves analyzing and refining code to improve speed, reduce resource consumption, and ensure scalability. Techniques such as algorithm optimization, code profiling, and efficient memory management are commonly employed. By optimizing performance, developers can ensure that software meets user expectations and operates effectively under varying workloads. This process is not a one-time task but an ongoing effort to adapt to evolving user demands and technological advancements, making it essential for maintaining competitive and robust software solutions."
1009,Emerging Technologies in Software Engineering,"Emerging technologies in software engineering are revolutionizing how developers create, deploy, and manage software systems. Cloud computing, artificial intelligence, and machine learning are at the forefront, enabling scalable and intelligent applications. DevOps practices streamline development and operations, enhancing collaboration and efficiency. Blockchain technology introduces new paradigms for security and decentralization, while the Internet of Things (IoT) expands the scope of software to interconnected devices. Quantum computing, though in nascent stages, promises unprecedented computational power. These innovations not only improve software functionality and performance but also pose new challenges, necessitating ongoing adaptation and learning within the software engineering community."
1010,Open Source Software Development,"Open source software development is a collaborative approach to creating software, where the source code is made publicly available for anyone to inspect, modify, and enhance. This model fosters innovation by leveraging the collective expertise of a global community of developers. It promotes transparency, allowing users to understand how software functions and ensuring security through peer review. Open source projects, like Linux and Apache, have become integral to technology infrastructure. This development model democratizes software creation, reducing costs and increasing accessibility. Ultimately, open source software development exemplifies the power of community-driven progress in advancing technology for the common good."
1011,Impact of Climate Change on Biodiversity,"Climate change profoundly affects biodiversity, altering ecosystems and threatening species survival globally. Rising temperatures and shifting precipitation patterns disrupt habitats, forcing species to migrate, adapt, or face extinction. Coral reefs, often referred to as the ""rainforests of the sea,"" are bleaching due to warmer waters, affecting countless marine organisms. Terrestrial species experience mismatches in timing, such as flowering and pollination, due to changing climates. Additionally, climate change intensifies weather events, further stressing ecosystems. This loss of biodiversity diminishes ecosystem services essential for human survival, such as pollination, water purification, and carbon storage, underscoring the urgent need for climate action to preserve the"
1012,Renewable Energy Solutions to Combat Climate Change,"Renewable energy solutions are pivotal in combating climate change by reducing greenhouse gas emissions and fostering sustainable development. Solar, wind, and hydropower harness natural forces, offering cleaner alternatives to fossil fuels. Solar panels convert sunlight into electricity, while wind turbines generate power from air currents, both significantly lowering carbon footprints. Hydropower, utilizing flowing water, provides a reliable and efficient energy source. These technologies not only mitigate climate change impacts but also promote energy independence and economic growth. Investing in and expanding renewable energy infrastructure is essential for a sustainable future, ensuring environmental preservation and a healthier planet for future generations."
1013,Climate Change and Its Effect on Global Food Security,"Climate change poses a significant threat to global food security through its impacts on agricultural productivity, water supply, and ecosystem health. Rising temperatures and unpredictable weather patterns disrupt crop yields, leading to food shortages and increased prices. Droughts and floods further exacerbate these challenges by damaging arable land and reducing the availability of freshwater for irrigation. Additionally, climate change affects fisheries and livestock, undermining the stability of food supply chains. Vulnerable populations in developing countries are disproportionately affected, facing heightened risks of hunger and malnutrition. Addressing climate change is crucial to ensuring a sustainable and resilient global food system for future generations."
1014,Carbon Capture and Storage (CCS) Technologies,"Carbon Capture and Storage (CCS) technologies represent a pivotal strategy in mitigating climate change by reducing carbon dioxide emissions from industrial and energy sources. CCS involves three key steps: capturing carbon dioxide emissions from sources like power plants, transporting the captured CO2 to storage sites, and securely storing it underground in geological formations. This technology not only aids in reducing the carbon footprint of fossil fuel-based industries but also supports the transition to a low-carbon economy. As global efforts intensify to meet climate targets, CCS offers a critical tool in balancing energy demands with environmental responsibilities, potentially transforming energy landscapes."
1015,Role of Urban Planning in Climate Adaptation,"Urban planning plays a crucial role in climate adaptation by designing cities that are resilient to climate-related challenges. It involves integrating sustainable practices into the development of infrastructure, such as green spaces, efficient public transport, and resilient buildings, which help mitigate the impacts of extreme weather events. Effective urban planning considers the natural environment, promoting biodiversity and water management systems to prevent flooding and heatwaves. By incorporating climate adaptation strategies, urban planners can create livable cities that reduce vulnerabilities and enhance the quality of life for residents, ensuring long-term sustainability and resilience in the face of climate change."
1016,Ocean Acidification and Its Global Implications,"Ocean acidification is a critical environmental issue stemming from increased atmospheric carbon dioxide, primarily due to human activities such as fossil fuel combustion and deforestation. As CO2 dissolves in seawater, it forms carbonic acid, lowering the pH and altering ocean chemistry. This phenomenon poses a significant threat to marine life, particularly calcifying organisms like corals, mollusks, and some plankton species, which struggle to maintain their calcium carbonate structures in more acidic conditions. The ecological imbalance affects entire marine food webs, potentially disrupting fisheries and livelihoods. Furthermore, ocean acidification can impair the ocean's ability to sequester carbon, exacerbating global climate change."
1017,Economic Costs of Climate Change,"The economic costs of climate change are profound and multifaceted, affecting global economies in numerous ways. Rising temperatures lead to increased frequency and severity of natural disasters such as hurricanes, floods, and wildfires, causing billions in damages to infrastructure and property. Agricultural yields suffer due to altered weather patterns, threatening food security and driving up prices. Health-related costs surge as heatwaves and pollution exacerbate medical conditions. Additionally, climate change necessitates significant investment in adaptation and mitigation strategies, diverting resources from other critical areas. As ecosystems are disrupted, the loss of biodiversity also impacts industries reliant on natural resources, underscoring the urgent need for sustainable economic policies."
1018,Policy and International Agreements on Climate Change,"Global efforts to combat climate change have increasingly focused on policy and international agreements. The Paris Agreement, adopted in 2015, represents a landmark commitment by nearly 200 nations to limit global warming to below 2 degrees Celsius above pre-industrial levels. Countries set nationally determined contributions to reduce greenhouse gas emissions, fostering accountability and cooperation. Policies like carbon pricing, renewable energy incentives, and emission reduction targets are essential in national strategies. International agreements, while challenging to negotiate, play a crucial role in uniting diverse nations towards a common goal, addressing climate change's impacts, and promoting sustainable development worldwide."
1019,Role of Artificial Intelligence in Climate Change Mitigation,"Artificial Intelligence (AI) plays a pivotal role in climate change mitigation by enhancing energy efficiency, optimizing resource management, and advancing scientific research. AI algorithms analyze vast datasets to predict weather patterns, enabling better preparation for extreme weather events. In the energy sector, AI optimizes power grids and integrates renewable sources, reducing carbon footprints. Moreover, AI-driven models help in monitoring deforestation and identifying areas for reforestation, crucial for carbon sequestration. By facilitating precision agriculture, AI reduces waste and conserves water. Furthermore, AI accelerates climate research, offering innovative solutions for carbon capture and sustainable practices. Thus, AI is an essential tool in addressing climate change challenges."
1020,Climate Justice and Equity,"Climate justice and equity are crucial concepts in addressing global climate change. Climate justice emphasizes the ethical dimensions of climate change, focusing on how those least responsible for emissions often suffer its gravest consequences. It calls for fair treatment of all communities, ensuring vulnerable populations receive adequate support and resources. Equity involves distributing responsibilities and resources equitably, acknowledging that developed nations, having historically contributed the most to greenhouse gas emissions, should lead mitigation efforts. Addressing climate change through justice and equity ensures a more inclusive and effective global response, fostering resilience and sustainability for future generations."
1021,The Evolution of Cinematic Storytelling,"The evolution of cinematic storytelling reflects the dynamic interplay between technology and creativity. From the silent films of the early 20th century, where exaggerated expressions conveyed emotion, to the advent of sound and color that enriched narratives, cinema continually adapts. The mid-20th century saw the rise of auteur directors who infused personal vision, while the digital age introduced CGI and non-linear storytelling, expanding narrative possibilities. Today, streaming platforms have democratized content consumption, fostering diverse voices and global stories. This evolution underscores cinema's enduring power to reflect and shape human experience, captivating audiences through ever-innovative means."
1022,The Role of Special Effects in Modern Filmmaking,"Special effects play a pivotal role in modern filmmaking, transforming scripts into visually stunning narratives that captivate audiences worldwide. These effects, ranging from computer-generated imagery (CGI) to practical effects, enhance storytelling by creating immersive environments and lifelike characters that would be impossible to portray otherwise. They allow filmmakers to push the boundaries of imagination, bringing fantastic worlds and complex action sequences to life. Moreover, special effects contribute significantly to a film’s emotional impact, enabling directors to convey themes and emotions with greater intensity. As technology continues to advance, special effects will remain integral to the evolution and success of cinema."
1023,Representation and Diversity in Cinema,"Representation and diversity in cinema are crucial for fostering an inclusive society and enriching the narrative landscape of films. Historically, cinema has often marginalized or stereotyped minority groups, reinforcing societal biases. However, diverse representation allows audiences to see complex, authentic portrayals of different cultures, genders, and identities, promoting empathy and understanding. Films like ""Black Panther"" and ""Crazy Rich Asians"" highlight how diverse casts and stories can achieve both critical and commercial success, challenging the industry's status quo. By embracing diversity, cinema not only reflects the multicultural world we live in but also inspires change and broadens creative horizons."
1024,The Rise of Streaming Platforms and Their Impact on Cinema,"The rise of streaming platforms has revolutionized the cinema industry, altering how audiences consume films and reshaping the traditional movie-going experience. Platforms like Netflix, Amazon Prime, and Disney+ offer vast libraries of content accessible from the comfort of one's home, challenging the dominance of theatrical releases. This shift has democratized film distribution, allowing independent filmmakers to reach global audiences without relying solely on cinemas. However, it has also sparked debates about the future of theaters and the communal experience they provide. As streaming services continue to gain popularity, the cinema industry must adapt to maintain its cultural and social significance."
1025,The Auteur Theory in Modern Filmmaking,"The auteur theory, originating in the mid-20th century, posits that a film reflects the director's personal creative vision, much like an author's influence on a novel. In modern filmmaking, this notion continues to hold relevance as directors increasingly imprint their unique styles on cinematic works. Visionaries like Quentin Tarantino and Wes Anderson exemplify modern auteurs, with distinctive storytelling techniques and visual aesthetics. However, the collaborative nature of filmmaking challenges this theory, as writers, producers, and actors also significantly impact the final product. While the auteur theory highlights the director's role, contemporary cinema underscores the synergy of creative forces in filmmaking."
1026,Cinematography and Its Role in Visual Storytelling,"Cinematography is the art of capturing moving images on film or digital media, playing a crucial role in visual storytelling. It involves decisions about camera angles, lighting, composition, and movement, all of which shape the narrative and evoke emotions. Through techniques such as framing and depth of field, cinematographers guide the audience's focus and enhance the storytelling experience. Lighting sets the mood, while camera movements add dynamism to scenes. Cinematography not only complements the script but also adds layers of meaning, transforming stories into visually compelling experiences. Ultimately, it is an essential element that bridges the director's vision with the audience's perception."
1027,The Influence of Music and Sound Design in Cinema,"Music and sound design play pivotal roles in cinema, profoundly influencing the audience's emotional and psychological experience. Music can evoke a spectrum of emotions, from the suspenseful crescendos of a thriller to the poignant melodies of a drama, guiding viewers' reactions and enhancing narrative depth. Sound design, encompassing everything from ambient noise to sound effects, immerses audiences in the film's world, creating a sense of realism or fantasy. Together, these auditory elements elevate storytelling, offering cues that complement visual elements, and can transform a simple scene into a powerful, unforgettable cinematic moment, underscoring the indispensable role of sound in film."
1028,The Evolution of Independent Cinema,"Independent cinema has undergone a remarkable transformation since its inception. Initially, it emerged as an alternative to the mainstream Hollywood system, allowing filmmakers to explore unconventional narratives and innovative techniques. The 1960s and 70s saw pioneers like John Cassavetes push the boundaries of storytelling, paving the way for a vibrant indie scene. The advent of digital technology in the late 20th century democratized filmmaking, enabling artists with limited budgets to produce high-quality films. Festivals like Sundance provided a platform for these works, elevating indie cinema to new heights. Today, streaming services have further expanded its reach, making unique voices accessible to global audiences."
1029,The Role of Film Festivals in Shaping Global Cinema,"Film festivals play a pivotal role in shaping global cinema by serving as platforms for cultural exchange, artistic expression, and industry innovation. These events, from renowned festivals like Cannes and Sundance to emerging ones in diverse regions, spotlight unique voices and stories that might otherwise remain unheard. They foster networking opportunities among filmmakers, distributors, and critics, catalyzing collaborations across borders. By showcasing diverse narratives and experimental techniques, festivals influence mainstream cinema and inspire new trends. Furthermore, they provide filmmakers with the chance to gain critical acclaim and access wider audiences, ultimately enriching the cinematic landscape with varied perspectives and storytelling styles."
1030,The Intersection of Cinema and Social Change,"Cinema has long served as a powerful catalyst for social change, reflecting and shaping societal norms and values. Through storytelling, filmmakers illuminate pressing social issues, challenge stereotypes, and inspire activism. Iconic films like ""To Kill a Mockingbird"" and ""Schindler's List"" have raised awareness about racial injustice and the horrors of the Holocaust, respectively. Documentaries such as ""An Inconvenient Truth"" have sparked global environmental movements. By reaching diverse audiences, cinema transcends cultural and linguistic barriers, fostering empathy and understanding. In this intersection of art and activism, cinema not only entertains but also educates and empowers individuals to envision and strive for a"
1031,The Evolution of Michael Jackson’s Music,"Michael Jackson's musical evolution is a testament to his unparalleled artistry and ability to transcend genres. Beginning with the youthful exuberance of ""I Want You Back"" as a member of The Jackson 5, his early career was marked by infectious Motown rhythms. As a solo artist, Jackson's sound matured with ""Off the Wall,"" blending disco and funk, setting the stage for his groundbreaking ""Thriller,"" which revolutionized pop music with its fusion of rock, pop, and R&B. Albums like ""Bad"" and ""Dangerous"" showcased his innovative use of technology and social themes. Jackson’s music continually evolved, reflecting personal growth and societal changes, solidifying"
1032,Michael Jackson as the King of Pop,"Michael Jackson, universally hailed as the ""King of Pop,"" revolutionized the music industry with his unparalleled talent, innovation, and charisma. Emerging as a child prodigy with the Jackson 5, he captivated audiences with his extraordinary vocal range and mesmerizing dance moves. Jackson's solo career ascended to unprecedented heights with timeless albums like ""Thriller,"" which remains the best-selling album of all time. His influence transcended music, reshaping fashion, music videos, and live performances. Jackson's ability to blend various musical genres and his commitment to humanitarian efforts further solidified his legacy, ensuring his reign as the King of Pop endures across generations."
